{
  "$schema": "https://json-schema.org/draft/2020-12/schema",
  "$id": "urn:specimendb:biomemetics:mantis:assistant:contracts:dynamic-workflow-definition:v1",
  "title": "Mantis dynamic workflow definition",
  "description": "JSON graph for a candidate Mastra dynamic workflow. P0-P2 research/analysis only. Device command, browser mutation, secrets, and canonical/SpecimenDB writes are prohibited.",
  "type": "object",
  "additionalProperties": false,
  "required": [
    "schemaVersion",
    "kind",
    "definitionId",
    "version",
    "digest",
    "capabilityClass",
    "author",
    "inputSchema",
    "outputSchema",
    "graph",
    "referencedPrimitives",
    "prohibited"
  ],
  "properties": {
    "$schema": { "type": "string" },
    "schemaVersion": { "const": "1.0.0" },
    "kind": { "const": "DynamicWorkflowDefinition" },
    "definitionId": {
      "type": "string",
      "pattern": "^wf\\.[a-z][a-z0-9.-]*$"
    },
    "version": { "type": "string", "minLength": 1 },
    "digest": { "type": "string", "pattern": "^[a-f0-9]{64}$" },
    "description": { "type": "string" },
    "capabilityClass": { "enum": ["P0", "P1", "P2"] },
    "author": { "type": "string", "minLength": 1 },
    "sourcePrompt": { "type": "string" },
    "modelRun": { "type": "string" },
    "expiresAt": { "type": "string", "format": "date-time" },
    "inputSchema": { "type": "object" },
    "outputSchema": { "type": "object" },
    "stateSchema": { "type": "object" },
    "graph": {
      "type": "array",
      "minItems": 1,
      "items": {
        "type": "object",
        "required": ["type", "id"],
        "properties": {
          "type": {
            "enum": ["tool", "agent", "workflow", "mapping"]
          },
          "id": { "type": "string", "minLength": 1 },
          "toolId": { "type": "string" },
          "agentId": { "type": "string" },
          "workflowId": { "type": "string" }
        }
      }
    },
    "referencedPrimitives": {
      "type": "array",
      "minItems": 1,
      "items": {
        "type": "object",
        "additionalProperties": false,
        "required": ["kind", "id", "version", "assayId"],
        "properties": {
          "kind": { "enum": ["tool", "agent", "workflow"] },
          "id": { "type": "string", "minLength": 1 },
          "version": { "type": "string", "minLength": 1 },
          "assayId": { "type": "string", "minLength": 1 }
        }
      }
    },
    "prohibited": {
      "type": "object",
      "additionalProperties": false,
      "required": [
        "deviceCommand",
        "browserMutation",
        "secrets",
        "directCanonicalMutation",
        "specimenDbWrite"
      ],
      "properties": {
        "deviceCommand": { "const": true },
        "browserMutation": { "const": true },
        "secrets": { "const": true },
        "directCanonicalMutation": { "const": true },
        "specimenDbWrite": { "const": true }
      }
    }
  },
  "unevaluatedProperties": false
}
