{
  "schemaVersion": "1.0.0",
  "kind": "DynamicWorkflowDefinition",
  "definitionId": "wf.composer-self-admit",
  "version": "1.0.0",
  "description": "Valid P0 graph used to prove composer cannot admit own output.",
  "capabilityClass": "P0",
  "author": "workflow-composer-fixture",
  "expiresAt": "2027-08-21T00:00:00Z",
  "inputSchema": {
    "type": "object",
    "properties": {
      "topic": {
        "type": "string"
      }
    },
    "required": [
      "topic"
    ]
  },
  "outputSchema": {
    "type": "object",
    "properties": {
      "result": {
        "type": "string"
      }
    },
    "required": [
      "result"
    ]
  },
  "stateSchema": {
    "type": "object"
  },
  "graph": [
    {
      "type": "tool",
      "id": "lookup",
      "toolId": "care-source-read"
    }
  ],
  "referencedPrimitives": [
    {
      "kind": "tool",
      "id": "care-source-read",
      "version": "1.0.0",
      "assayId": "assay.care-source-read.v1"
    }
  ],
  "prohibited": {
    "deviceCommand": true,
    "browserMutation": true,
    "secrets": true,
    "directCanonicalMutation": true,
    "specimenDbWrite": true
  },
  "digest": "0b4df07cf093de9ff3910cf125dd471f65b4aea64f1d9c840a70c6a98311eebf"
}
